{
  "schema": "qmentor.program-ir.v2",
  "source": {
    "framework": "pulser",
    "version": "1.9.1",
    "entry": "examples/bond-selection/pasqal-pulser/main.py::build_qaa_sequence",
    "parse_status": "imported-and-built"
  },
  "paradigm": "analog neutral-atom (Rydberg) evolution",
  "register": {
    "device": "AnalogDevice",
    "qubit_order": [
      "q0",
      "q1",
      "q2",
      "q3"
    ],
    "coordinates_um": {
      "q0": [
        -9.0,
        0.0
      ],
      "q1": [
        -3.0,
        0.0
      ],
      "q2": [
        3.0,
        0.0
      ],
      "q3": [
        9.0,
        0.0
      ]
    },
    "interaction_coeff_C6": 865723.02
  },
  "initial_state": "all atoms in ground state |g>",
  "hamiltonian": {
    "form": "H(t)/hbar = Omega(t)/2 sum_i sigma^x_i - delta(t) sum_i n_i + sum_{i<j} C6/r_ij^6 n_i n_j",
    "interaction_terms": {
      "q0-q1": 18.555448817,
      "q0-q2": 0.289928888,
      "q0-q3": 0.025453291,
      "q1-q2": 18.555448817,
      "q1-q3": 0.289928888,
      "q2-q3": 18.555448817
    }
  },
  "controls": [
    {
      "channel": "rydberg_global",
      "addressing": "Global",
      "duration_ns": 4000,
      "amplitude": {
        "waveform": "InterpolatedWaveform",
        "points_rad_per_us": [
          0.0,
          5.026548246,
          0.0
        ]
      },
      "detuning": {
        "waveform": "InterpolatedWaveform",
        "points_rad_per_us": [
          -6.0,
          0.0,
          6.0
        ]
      },
      "phase": 0.0
    }
  ],
  "gates": [],
  "measurement": {
    "basis": "ground-rydberg",
    "outcome_1_means": "Rydberg state |r>"
  },
  "decoding": {
    "bit_order": "register qubit order q0..q3 = bitstring characters left to right",
    "objective": "canonical QUBO energy of the decoded bitstring"
  },
  "unsupported_features_for_gate_targets": [
    "continuous-time analog evolution under Omega(t), delta(t) with always-on Rydberg interactions",
    "adiabatic schedule semantics (success depends on the gap along the sweep, not on gate angles)"
  ]
}
